{
  "schemaVersion": 1,
  "id": 8,
  "title": "Carboxylic Acids",
  "description": "Connect acidity, acyl reactions, decarboxylation, and amphiphilic behavior.",
  "objectives": [
    "Predict acid ionization and physical properties",
    "Explain esterification, activation, and reduction",
    "Track decarboxylation and saponification"
  ],
  "sources": [
    {
      "label": "Supplied Kaplan curriculum: Chapter 8; section scope checked against local body and summary",
      "location": "organic_chemistry_kaplan/OEBPS/chapter08b.xhtml"
    }
  ],
  "review": {
    "status": "author-reviewed",
    "note": "Original explanations and exercises; source-backed author review, not independent expert verification."
  },
  "lessons": [
    {
      "id": "acid-properties",
      "label": "Carboxylic acid structure and acidity",
      "title": "Carboxylic acid structure and acidity",
      "molecule": "aceticacid",
      "tag": "Two oxygens stabilize the conjugate base",
      "cards": {
        "rule": "<p>A carboxyl group has C=O and OH bonded to the same carbon. Carboxylic acids hydrogen bond and can dimerize, especially in nonpolar media. Their carboxylates are resonance stabilized. Electron-withdrawing substituents generally increase acidity, with inductive effects weakening over distance.</p>",
        "cue": "<p>pH above pKa → more carboxylate. pH below pKa → more neutral acid.</p>",
        "trap": "<p>The OH of a carboxyl group is not classified as an ordinary alcohol group. A ring can carry COOH; its carboxyl carbon need not belong to the ring. Larger hydrocarbon regions can still limit aqueous solubility.</p>",
        "app": "<p>Ionization controls how fatty acids, drug acids, and amino-acid side chains partition between environments.</p>"
      },
      "steps": [
        {
          "label": "1. Recognize COOH",
          "text": "<p>The acid functional group includes both oxygens and their shared carbon. Its carbon has no room for another carbon substituent beyond the existing skeleton.</p>",
          "molecule": "aceticacid",
          "highlights": {
            "prin": [
              1,
              2,
              3
            ]
          },
          "reveal": true
        },
        {
          "label": "2. Change pH",
          "text": "<p>Adjust pH around a model pKa of 4.8. At pH=pKa, [A−]=[HA]; two units above pKa gives a 100:1 ratio, about 99% A−.</p>",
          "molecule": "acetate",
          "highlights": {
            "prin": [
              1,
              2,
              3
            ]
          },
          "reveal": true,
          "diagram": {
            "type": "acid",
            "pKa": 4.8,
            "caption": "Acid/carboxylate speciation model; approximate dilute-solution treatment."
          }
        }
      ]
    },
    {
      "id": "acid-reactions",
      "label": "Formation and acyl substitution",
      "title": "Formation and acyl substitution",
      "molecule": "aceticacid",
      "tag": "Activate the acid or use appropriate catalysis",
      "cards": {
        "rule": "<p>Primary alcohols and aldehydes can be oxidized to acids. Fischer esterification combines acid and alcohol under acid catalysis; removing water or using excess alcohol drives the reversible reaction. Direct acid plus amine usually first gives an ammonium carboxylate salt; efficient amide synthesis generally requires activation or dehydrating conditions.</p>",
        "cue": "<p>Proton transfer is often faster than acyl substitution. Check it before drawing a new amide bond.</p>",
        "trap": "<p>OH− is a poor leaving group. Acid catalysis can enable water loss; coupling reagents or reactive acid derivatives can enable amide formation. Do not draw spontaneous amide synthesis just by mixing acid and amine in water.</p>",
        "app": "<p>Peptide synthesis uses activated carboxyl groups; enzyme-catalyzed biosynthesis likewise supplies activation and organization.</p>"
      },
      "steps": [
        {
          "label": "1. Acid substrate",
          "text": "<p>The electrophilic acyl carbon is the carbonyl carbon. Protonating carbonyl oxygen increases electrophilicity in acid-catalyzed esterification.</p>",
          "molecule": "aceticacid",
          "highlights": {
            "prin": [
              1,
              2,
              3
            ]
          },
          "reveal": false
        },
        {
          "label": "2. Ester product pattern",
          "text": "<p>An ester has an OR group where the acid had OH. This example is ethyl propanoate: the O-ethyl and three-carbon acyl portions have different origins.</p>",
          "molecule": "ester",
          "highlights": {
            "path": [
              2,
              1,
              0
            ],
            "prin": [
              2,
              3,
              4
            ],
            "sub": [
              5,
              6
            ]
          },
          "reveal": true
        },
        {
          "label": "3. Amide product pattern",
          "text": "<p>An amide has N attached directly to the acyl carbon. Formation requires conditions that overcome acid–base salt formation and poor leaving-group ability.</p>",
          "molecule": "acetamide",
          "highlights": {
            "prin": [
              1,
              2,
              3
            ]
          },
          "reveal": true
        }
      ]
    },
    {
      "id": "reduction-decarboxylation",
      "label": "Reduction and beta-keto-acid decarboxylation",
      "title": "Reduction and beta-keto-acid decarboxylation",
      "molecule": "acetoaceticacid",
      "tag": "Track carbon atoms, not just functional groups",
      "cards": {
        "rule": "<p>LiAlH4 followed by appropriate aqueous workup reduces a carboxylic acid to a primary alcohol. Ordinary NaBH4 conditions generally do not. Heating a beta-keto acid can release CO2 through a favorable cyclic transition state, initially giving an enol that tautomerizes to a carbonyl.</p>",
        "cue": "<p>Reduction retains the acid carbon. Decarboxylation loses it as CO2.</p>",
        "trap": "<p>A beta-keto acid has a ketone at the beta position relative to the acid carbon. Not every carboxylic acid readily decarboxylates on heating. The six-membered arrangement is a transition state, not a stable ring intermediate.</p>",
        "app": "<p>Decarboxylation changes carbon count, a useful check when following metabolic or synthetic pathways.</p>"
      },
      "steps": [
        {
          "label": "1. Number the beta-keto acid",
          "text": "<p>C1 is the carboxyl carbon, C2 is alpha, and C3 is the ketone-bearing beta carbon.</p>",
          "molecule": "acetoaceticacid",
          "highlights": {
            "num": [
              0,
              1,
              2,
              3
            ],
            "prin": [
              0,
              4,
              5
            ],
            "sub": [
              2,
              6
            ]
          },
          "reveal": true
        },
        {
          "label": "2. Lose the acid carbon",
          "text": "<p>The carboxyl carbon leaves as CO2. The remaining three-carbon fragment initially forms an enol, then becomes acetone by tautomerization.</p>",
          "molecule": "acetone",
          "highlights": {
            "path": [
              0,
              1,
              2
            ],
            "prin": [
              1,
              3
            ]
          },
          "reveal": true
        }
      ]
    },
    {
      "id": "soap",
      "label": "Saponification and amphiphiles",
      "title": "Saponification and amphiphiles",
      "molecule": "laurate",
      "tag": "Hydrolysis produces carboxylate salts",
      "cards": {
        "rule": "<p>Saponification is base-promoted ester hydrolysis, including hydrolysis of triacylglycerols to glycerol and fatty-acid salts. A fatty-acid carboxylate has a polar ionic head and a nonpolar hydrocarbon tail, allowing micelle formation under suitable conditions.</p>",
        "cue": "<p>Head interacts with water; tails gather away from water.</p>",
        "trap": "<p>Neutralizing a free fatty acid makes its salt, but that acid–base reaction is not ester hydrolysis. A micelle has hydrophobic material inside; it is not the same structure as a lipid bilayer.</p>",
        "app": "<p>Soap can disperse nonpolar material into water through aggregates. Aggregation depends on concentration, ionic conditions, and tail structure.</p>"
      },
      "steps": [
        {
          "label": "1. Find the head group",
          "text": "<p>Laurate is a long-chain carboxylate. Its negative charge is represented on one O but delocalized over both. Counterions are omitted from this molecular-ion graph.</p>",
          "molecule": "laurate",
          "highlights": {
            "prin": [
              0,
              12,
              13
            ]
          },
          "reveal": true
        },
        {
          "label": "2. Contrast the tail",
          "text": "<p>The hydrocarbon tail interacts favorably with other nonpolar material. Many such tails can cluster while ionic heads contact the surrounding water.</p>",
          "molecule": "laurate",
          "highlights": {
            "path": [
              0,
              1,
              2,
              3,
              4,
              5,
              6,
              7,
              8,
              9,
              10,
              11
            ],
            "prin": [
              12,
              13
            ]
          },
          "reveal": false
        }
      ]
    }
  ],
  "exercises": [
    {
      "id": "acid-ratio",
      "lesson": "acid-properties",
      "molecule": "aceticacid",
      "label": "Calculate acid ionization",
      "title": "Calculate acid ionization",
      "stages": [
        {
          "type": "atoms",